Project Title,Output Description,Transparency Portal,Keyword,Country TRANSPARENCY,Budget,Expences from BPI,EXPENCES without minos
Ghana Shea Landscape Emission Reductions Project,"The forest ecosystems of Ghana’s Northern Savannah Zone (NSZ), an area of 9.7 million hectares with a population of over 5 million people, is characterized by nearly 400 million shea and other trees growing naturally on traditional farming systems. The trees are integrated with crops on smallholder farms, creating an agroforestry landscape resilient to climate change. These lands are facing a great threat with total forest cover having declined by over 77% between 2001-2015, with the conversion of 1,058,492 million hectares (ha) of woodlands to grasslands, croplands and degraded forests. This has resulted in Greenhouse Gas (GhG) emissions of an estimated 3.568 mtCO2e per annum. The main drivers of this deforestation and forest degradation are conversion to agriculture, cutting for timber and wood fuels and mid to late dry season fires.  \nThe loss and degradation of woodlands and forests including valuable trees like shea and other species pose significant environmental, social and economic risks in the NSZ, which constitutes the area of the country that records the lowest development indicators on average.  Shea landscapes are important sources of carbon storage and sequestration above-ground and in soils and roots. Shea grows naturally, is adaptable to a broad range of environmental conditions and provides essential products and ecological services to this dry region.\nThis project developed by the Government of Ghana and the United Nations Development Programme (UNDP) with support from partners has been approved by the GCF to address this alarming situation in a transformational manner, in line with national polices and plans and in particular with the shea landscape component of  the Ghana REDD+ Strategy .\n\nThe project advances a paradigm shift away from short-term, stop-gap measures to more integrated, multi-stakeholder coordination of investments to address the barriers  that currently prevent the restoration and sustainable management for forests and land and",https://open.undp.org/projects/00102734,"Deforestation, River",Ghana,2701413,2406889,2406889
Economic recovery and resilient livelihoods,"Regional instability and climate change effects have exacerbated socio-economic challenges and people's living standards in Djibouti especially those from vulnerable communities. it interfered with livelihoods and amplified the structural challenges faced by immediate livelihood needs  and food security. Improving livelihoods protection, strengthening human rights and legal support for displaced people with special attention to vulnerable women, is one of the main pillar to enhance resilience, promote social cohesion and communities stability.\n\nThe Government of Djibouti and UNDP launched this project with an aim to build resilience by promoting access to livelihoods for vulnerable and displaced people. While the overall project aims to address the needs of all the climate- displaced communities of Djibouti, the first phase will focus on the needs of the most vulnerable population displaced from Balbala and relocated to Cheikh Farah site. \n\nThe increased vulnerability to climate induced disasters in Djibouti activated the national emergency response and UNDP as one of the key partners in emergency preparedness and response to:\n- Output 1: Community participation increased,\n- Output 2: Support at-risk and displaced women and men in targeted communities, by providing them with coping and support mechanisms so that they can benefit from climate resilient livelihoods protection interventions, water, fodder and shelter.\n\nOutput 3: Improve the gender sensitive approach in early recovery, livelihood and employment planning and coordination.",https://open.undp.org/projects/00107644,Water,Djibouti,2909125,2413887,2413887
Strengthening Access to Health Care and Community Led De,"This proposal is designed to provide support to vulnerable communities with specific emphasis on maternal, child and adolescent cohorts in the restoration of access to basic health care and the promotion of resilient communities in rural Sierra Leone. The project aims to strengthen universal health care coverage and health delivery systems in twelve communities of two border districts by; supporting local governance structures pertaining to communal health service delivery, promoting appropriate health seeking behaviour as in line with  MOHS guidelines, community health care workers policy, aiding the delivery of quality health care through the rehabilitation of WASH  features and the provision of a supporting framework for increased community led advocacy targeting vulnerable communities health seeking behaviour.\nThe project aims at promoting an integrated and gender sensitive approach to improving health outcomes for vulnerable border communities by restoring access to basic health care and changing health seeking behaviour",https://open.undp.org/projects/00095444,WASH,Sierra Leone,2517878,2433220,2433220
DICT Interest Earning-Ty Odette Response,"On the request of DICT to provide rapid response in disaster situations with its frontliner role on emergency telecommunications, the UNDP will assist the DICT cluster offices at the regional and\/or provincial levels in 7 typhoon-damaged provinces (Surigao del Norte, Dinagat Islands, Bohol, Southern Leyte, Cebu, Negros and Palawan) to swiftly restore the coordination and communication capacity of the agency. Procurement of ICT devices and support equipment in the delivery of public service, including the provision of assistance in sustaining the operations of presently deployed equipment and systems, shall be extended.",https://open.undp.org/projects/00087256,Dam,Philippines,4291371,2459455,2459455
UNDP Flood recovery - Housing FBIH,"The overall objective of the Project is to support the sustainable recovery of flood- and landslide-affected communities in the entity of FBiH. Approximately 225 people, out of whom at least 40% are women, in flood-affected areas will benefit directly from the Project’s assistance.",https://open.undp.org/projects/00105031,Flood,Bosnia and Herzegovina,3433086,2498837,2498837
Ridge to Reef - Bio Diversity & Ecosystem protection,"The Nauru Ridge to Reef Project (R2R) is a four years funded project aimed to protect biodiversity and ecosystems functions in Nauru.  It will encompass management of the whole island focusing first 5 key sites (Anabar, Ijuw, Anibare, Meneng, Buada) with the intension to expand the project to other sites during the project timeframe. The project's outcomes are: (i) Improved management effectiveness of new  marine conservation areas, (ii) Integrated landscape management practices adopted by local communities living within the ‘bottom-side’ and applicable ‘ridge’, and ‘topside’ areas not covered by mining, (iii) Biodiversity conservation and Sustainable Land Management (SLM) mainstreamed in policy and regulatory frameworks, and (iv) Knowledge Management.",https://open.undp.org/projects/00084678,Ridge to Reef,Nauru,2839078,2510563,2510563
Rakhine Area Based -Triple Nexus Project (RTNP),"Displaced populations and other vulnerable communities including stateless populations, have better access to essential services, protection, and improved fundamental rights",https://open.undp.org/projects/00139333,Dam,Myanmar,3540774,2512038,2512038
Small Grants project,"To enable community-based organizations to take collective action for adaptive landscape management for socio-ecological resilience through design, implementation, and evaluation of grant projects for global environmental benefits and local sustainable development in three ecologically sensitive landscapes: the Knuckles Conservation Forest and its buffer zone, the coastal region from Mannar Island to Jaffna, and the Colombo Wetlands.",https://open.undp.org/projects/00085746,Wetland,Sri Lanka,3489620,2516434,2516434
USAID-Crisis Recovery Support,"In response to appeals from the government of Djibouti for immediate assistance as a result of the massive flooding, between November 21 and 28. This activity  will provide emergency assistance to some of the over 250,000 people affected by supplying blankets, water reservoirs, water pumps, plastic safety sheets and to clean debris and waste.   As a result of the flooding the government of Djibouti activated its emergency plan (ORSEC) and requested support from international partners as the local capacities to respond to the crisis are insufficient. The Ministry of Interior supported by the Executive Secretariat for Disaster Management (SEGRC) is coordinating relief efforts. MASS oversees the response operational coordination. The United Nations Country Team, USG and other continues to support the government in the response. Dwellings, shops, schools and infrastructure have been damaged. In some neighborhoods, access to electricity was also interrupted. In other areas of the country, damages to roads and flash floods have affected access to several communities. Current disaster response mechanisms are insufficient, inadequate or inexistent; leaving the people to fend for themselves, do without and with not much more than the bare minimum to survive. This activity addresses some of the immediate early recovery needs.",https://open.undp.org/projects/00125686,"Dam, Flood, Water",Djibouti,3594935,2526037,2526037
Emergency Support to Strengthen the Resilience,"UNDP targets affected communities primarily for debris removal and solid waste management through provision of needed equipment and materials and cash-for-work schemes, rehabilitation of sewage and water networks, and provision of renewable energy solutions. UNDP also addresses major service delivery problems to contribute to the early recovery and to improve living conditions for people in the affected areas and help accelerating the return of the IDPs to their homes and revitalization of basic business services in these cities.  The proposed project will be utilized for the immediate stabilization of areas where local agreements have recently been reached. UNDP is working to identify urgent needs and priorities in consultation with the local community.",https://open.undp.org/projects/00100923,Water,Syria,2636889,2530575,2530575
Enhancing Greater Metro Manilaâ€™s (GMMA)Institutional Cap,"The Project Enhancing Greater Metro Manila’s Institutional Capacities for Effective Disaster\/Climate  Risk Management towards Sustainable Development (herein referred as the GMMA READY Project) aims to decrease the vulnerability of the Greater Metro Manila Area (GMMA) to natural hazards and increase its resilience, by strengthening the institutional capacities of the local government units, concerned national government agencies, academic institutions and civil society organizations to manage disaster and climate change risks. It will attempt to achieve this outcome by: a.) assessing the GMMA’s vulnerabilities to disaster and climate change risks; b.) developing and implementing priority disaster\/climate risk mitigation actions for GMMA such as formulation and testing of an integrated contingency plan and establishment of early warning systems; 3.) enhancing the competencies of GMMA LGUs and critical partners to mainstream DRM\/CRM into local planning and regulatory processes;4.) demonstrating the mainstreaming of DRM\/CRM into local land use\/development plan(s) and regulatory processes of Metro Manila and selected GMMA LGUs; and 5.) establishing a knowledge management system, including a vigorous Community of Practice, on Disaster\/Climate Risk Management. The project is envisioned to achieve all the results over a period of three (3) years and expected to improve mechanisms and protocols on DRM\/CRM. The project covers Metro Manila and the provinces of Rizal and Bulacan.",https://open.undp.org/projects/00061036,Flood,Philippines,2750531,2563787,2563787
National Adaptation Plan,"The Green Climate Fund Readiness and Preparatory Support for National Adaptation Plan in Ecuador project has two major objectives: \n\n(a) To reduce vulnerability to the impacts of climate change, by building adaptive capacity and resilience in the prioritized sectors or thematic areas established by the NSCC.  \n\n(b) To facilitate the coherent integration of climate change adaptation into development planning processes, policies and strategies related to six prioritized sectors i) Natural Heritage; ii) Water Heritage; iii) Food Sovereignty, Agriculture, Livestock, Aquaculture and Fisheries; iv) Health; v) Productive and Strategic Sectors; and, vi) Human Settlements, as well as into new and existing related programmes and projects.",https://open.undp.org/projects/00101840,Water,Ecuador,3076582,2584446,2584446
Small Grants Programme in Kazakhstan,"Community-level organizations in Kazakhstan often lack essential adaptive management capabilities such as technical know-how, planning skills, experimentation capacities and organizational abilities, and may resort to unsustainable land and biodiversity resource-use practices that can threaten desert and steppe ecosystems. This phase of the SGP will focus on desert and steppe landscapes by supporting community organizations to develop and implement adaptive management projects that build social, economic, and ecological resilience based on, and reinforced, by global environmental and local sustainable development benefits. Community organizations’ activities that promote climate change adaptation and mitigation, sustainable land management, including agro-ecosystem management and integrated water resources management, and biodiversity conservation, will be supported and synergized to achieve results at the landscape level.",https://open.undp.org/projects/00102856,Water,Kazakhstan,2657617,2606637,2606637
GEF - Arafura & Timor Seas Action Prog. (ATSEA 2) Region,"1.\tRegional Coordination Committee and a supporting Secretariat created to promote regional level planning, cooperation and monitoring  in the implementation of the SAP and NAPs; formal regional cooperation agreement adopted and implemented where feasible\n2.\tImproved stakeholder participation at the regional and national levels through the establishment of a Stakeholder Partnership Forum for the implementation of the SAP and NAPs (SAP) with representation of local people and women’s groups\n3.\tImproved inter sectoral coordination at the national and local levels in support of the implementation of integrated approaches to NRM, water resources, biodiversity conservation and climate change adaptation, through national inter-ministry committees in Indonesia, Timor-Leste, and Papua New Guinea\n4.\tFinancial mechanisms in place to support the implementation of the SAP and NAPs and the replication and upscaling of demonstration projects\n5.\tHarmonization of national and local policy in Indonesia and Timor-Leste to strengthen the regulatory and institutional frameworks in support of SAP\/NAP implementation  and linkages to NBSAPs through support to national inter-ministerial committees\n6.\tLocalization and translation of guidelines and\/or handbook on integrated approaches to marine and coastal management, biodiversity conservation and climate change adaptation in local language by building on existing\/completed initiatives; implementation of training of trainers benefitting at least 100 participants in Indonesia; 60 in Timor-Leste, and 10 in Papua New Guinea\n7.\tImproved understanding of climate change impacts on fisheries and marine\/coastal ecosystems through reginal collaborative assessment \n8.\tCase study on climate change impact pathways on an ATS area-specific fishery; regional climate change workshop organized\n9.\tUpdated ATS transboundary diagnostic analysis (TDA) endorsed by the ATS Regional Coordination Committee\n10.\tUpdated SAP, incorporating improved understanding of cl",https://open.undp.org/projects/00111335,Water,Indonesia,3009149,2610937,2610937
Livelihood & Recovery Gedeo Guji,"The project will strengthen the communities affected by multiple disasters such as COVID-19, desert locusts, floods and conflict in Oromia and SNNP Regional States. The objective is for people, particularly women and youth, to be able to rebuild their livelihoods, enjoy improved access to basic services, benefit from improved resilience livelihood opportunities, live in a peaceful environment, and to contribute their voices in an effort to improve local governance systems and all democratic processes. Gedeo, Segen Peoples and West Guji Zones have been the hardest hit with the combined effects of COVID-19, desert locusts, floods and past and current ongoing conflicts, which resulted in loss of livelihood and assets; and caused insecurity and trauma among individuals",https://open.undp.org/projects/00134506,Flood,Ethiopia,2848057,2677520,2677520
MH Water Security Project (GCF),Vulnerable households in targeted communities will have improved access to water ans trategies to response to climate vulnerability in outer atolls and island of RMI,https://open.undp.org/projects/00098709,Water,Marshall Islands,3128440,2696744,2696744
Advanced cross-river capacities for trade,"Men and women on both banks of the Nistru River have better livelihoods and living conditions, due to improved cross-river cooperation to access the opportunities offered by Moldova’s external trade arrangements, contributing to an environment of trust and cooperation across the post-conflict divide",https://open.undp.org/projects/00104938,River,"Moldova, Republic of",2882280,2723693,2723693
Flood recovery - Housing interventions in Federation of Bosnia and Herzegovina with Hilfswerk Austria International (HWA),"The overall objective of the Project is to support the sustainable recovery of flood- and landslide-affected communities in the entity of FBiH. Approximately 420 people, out of whom at least 40% are women, in flood-affected areas will benefit directly from the Project’s assistance.",https://open.undp.org/projects/00105033,Flood,Bosnia and Herzegovina,3994629,2786711,2786711
Flood recovery - Housing interventions in Federation of Bosnia and Herzegovina with Arbeiter-Samariter-Bund (ASB),"The overall objective of the Project is to support the sustainable recovery of flood- and landslide-affected communities in the entity of FBiH. Approximately 480 people, out of whom at least 40% are women, in flood-affected areas will benefit directly from the Project’s assistance.",https://open.undp.org/projects/00105032,Flood,Bosnia and Herzegovina,3945192,2844669,2844669
Climate change adaptation and food security,"Implement the remaining activities of phase 1 of this project, titled \""Addressing climate change impacts on marginalized agricultural communities living in the Mahaweli River Basin of Sri Lanka\"". This includes developing household food security and building resilient livelihoods for rain-fed farming households, and building institutional capacity in village, local, regional, service delivery to reduce risks associated with climate induced rainfall variability in Madirigiriya, Lankapura and Walapane DS divisions.",https://open.undp.org/projects/00091122,River,Sri Lanka,3206977,2857166,2857166
Adaptive Capacity of Water Services to Climate Change,"With the immediate support; the project will strive to build capacity in the water resources sector through institutional strengthening with a view to ensuring the effective delivery of hydrological services, predicated on the realization that workable options for adapting to climate change",https://open.undp.org/projects/00074076,"Hydro, Water",Sierra Leone,3415469,3051825,3051825
Safeguarding rural communities and their physical assets,"Approximately 70% of Timor-Leste’s rural population (840,000 people) is highly vulnerable to climate changes, particularly increasing variability of rainfall and extreme weather events. Lives and livelihoods in the remote interior of the country and coastal regions are both highly exposed. Impacts of intensified extreme events include damage and degradation of decentralized small-scale critical infrastructure, particularly water supply and drainage structures, embankments, and feeder roads and bridges. Damages leave rural populations isolated, lacking basic services. According to climate change scenarios and risk models, occurrences of climate extremes and related damages will at least double towards mid- century.\nThe project objective is to safeguard vulnerable communities and their physical assets from climate change-induced disasters. It aims to address existing institutional, financial and legislative barriers, increasing the  climate  resilience  of  vulnerable  small-scale  rural infrastructure. Output 1 focuses on strengthening the capacity of mandated institutions to assess and manage climate risks in order to maintain local infrastructure services. GCF-funded activities will embed new skills, technologies, and innovative methods in climate risk identification and mitigation processes. Monitoring and recording of climate risk information will be enhanced, and these data will be integrated into policies, standards, guidelines, and long-term investment planning for small-scale rural infrastructure. Output 2 focuses on implementing climate resilient building measures to improve small-scale rural infrastructure in vulnerable areas. GCF funds will assist in the development and implementation of catchment management strategies, supporting long-term resilience and climate risk reduction via landscape restoration and enhanced land stability, particularly in vulnerable catchments where small-scale   infrastructure is present. \nThe project targets 175,840 direct bene",https://open.undp.org/projects/00106661,"Water, Dam",Timor-Leste,7101607,3085284,3085284
Biodiversity of Western Tian Shan,"The Western Tian Shan is one of the world’s 200 priority ecoregions and one of 34 global biodiversity hotspots, and has been designated as a natural World Heritage Site. The Tian Shan act as a bridge connecting fauna and flora of Himalayas and Hindu Kush across Pamir with biota of Siberia, and across Dzungar Ala-Tau and Altay with biota of Mongolia, which results in a unique combination of fauna and flora elements. In the Western Tian Shan, fauna and flora are characterized by high diversity and concentration in a relatively small area. In terms of flora, higher plants number more than 2,500 species, and endemism of the flora is 12%; vertebrates number well over 400 species. However, many of the Western Tian Shan’s species and unique ecosystems are threatened by poor forest and land management; the region is home to 54 Red List plant species, and 27 Red List species of fauna, including the snow leopard. The forests of Western Tian Shan have juniper, spruce, maple, nut, fruit, and tugai forest communities, including fruit and nut wild relatives, but the regions forest resources are shrinking. These forests suffer from inadequate forest management and enforcement, and are degraded by intensive land use, such as overgrazing of forest pastures. The rate of natural regeneration and reforestation is unable to keep pace with the rate of forest degradation. The grassland areas of the Western Tian Shan are subject to extensive, uncontrolled agro-pastoral land use. Growing livestock numbers lead to extensive unregulated use of mountainous grasslands for grazing and causes high disturbance to wild ungulates such as argali and ibex, key snow leopard prey species. The rangelands of Western Tian Shan are susceptible to overgrazing, droughts, and inadequate natural regeneration in the face of these pressures. Today, over 60% of pastures in Western Tian are eroded and the quality of pastures has declined by four times compared to 1980s levels.",https://open.undp.org/projects/00097902,Drought,Kyrgyzstan,4277653,3155301,3155301
