Project Title,Output Description,Transparency Portal,Keyword,Country TRANSPARENCY,Budget,Expences from BPI,EXPENCES without minos
Structural Transformation for Economic Recovery,"Transitioning from the previous gains made during the implementation of the Strengthening Capacities for Poverty Reduction in previous CPD and as part of the building back better efforts and adopting the integrated framework of the 2030 Agenda of leaving no one behind, the fundamental focus of this project is to contribute to the efforts of the Government of the Kingdom of Eswatini to create greater access for vulnerable segments of the population to decent employment, equitable socio-economic opportunities and sustainable enterprise development in the country. The project is aimed to directly contribute to the efforts of the Government for increasing the footprint of the private sector in the economy, mainstreaming the Government’s SDG-aligned priorities into the financing systems (both public and private), and improving coordination capacities for economic recovery.",https://open.undp.org/projects/00142177,Dam,Eswatini,356371,-210356,0
Integrated Watershed Management`,Integrated Watershed Management for Improved Agro-Pastoral livelihoods in the Sebapala Sub-Catchment,https://open.undp.org/projects/00097375,Water,Lesotho,332864,-2638,0
Vlasina Pure Love Phase 1,"The Vlasina Pure Love project has the aim to, through a unique partnership with local authorities and Coca-Cola Hellenic Bottling Company, and by using sustainable, eco-friendly and modern technologies; update and upgrade the touristic offer on and around the Vlasina Lake, creating a sustainable tourism foundation for the overall sustainable economic growth of the region. The project is envisaged to have several phases, each building on to the previous to create a sustainable modern unique touristic offer to different target groups on the Vlasina Lake and the mountains around it.",https://open.undp.org/projects/00145921,Lake,Serbia,7830,0,0
Implementing Sustainable Low & non-Chemical Development,,https://open.undp.org/projects/00128540,SDG6,Seychelles,23351.00,0.00,0
Biodiversity and Water,Green Agenda in Serbia: Protecting and investing in biodiversity and water for enhanced climate resilience (SIDA funded),https://open.undp.org/projects/00147066,Water,Serbia,1,0,0
Improvement of Water Resources Management in Khatlon,"The overall goal of the project is to improve livelihoods of rural communities in project area vulnerable to climate changes. The specific project goal is to deliver capacity building support to local water authorities and service providers on O&M interventions for irrigation pumping stations and drinking water supply systems; tariff setting, billing and collection systems, and commercial management for self-sustaining – in 5 districts of Khatlon Region",https://open.undp.org/projects/00138716,Irrigation,Tajikistan,92124,1862,1862
SGP OP7,"The project aims to build of socio-ecological and economic resilience in the four identified landscapes and seascapes on the Eastern Seaboard of the Philippines - (1) Catubig Watershed Samar Island, (2) Aurora Province in the Sierra Madre, (3) Siargao Island Protected Landscape\/Seascape - and along the West Philippine Sea - (4) Calamianes Group of Islands in Northern Palawan - through community-based solutions for improved environmental benefits and sustainable development.",https://open.undp.org/projects/00119604,Water,Philippines,142012,5870,5870
Sustainable management of Dniester II Phase,"The strategy of the project “Support to the Moldovan authorities for the sustainable management of the Dniester River” is to improve environmental and social conditions in the Dniester River Basin District through enhanced management of water resources on the basis of updated regulatory framework, comprehensive and reliable river basin management planning, improved water management institutional capacities and implementation of practical environmental activities that would improve the ecological status of the Dniester River, identified as part of the Dniester Impact Study (2021).",https://open.undp.org/projects/00139217,River,"Moldova, Republic of",469263,9022,9022
AdTrade Phase III,"-\tAn improved regulatory and institutional framework for cross-river trade and integration of Transnistrian region’s exporters into the Moldovan external trade\n-\tIncreased awareness among companies and business associations in the Transnistrian region on the opportunities provided by DCFTA, as well as the technical steps needed to access EU markets\n-\tImproved capacities of business associations on both banks (at least 10 in Transnistrian region) to advocate for, cooperate and support the interests of the business communities across the river\n-\tImproved business environment due to effective advocacy\/lobby measures on reduction of barriers to trade and economic cooperation;\n-\tOver 70 companies from the Transnistrian region received consultancy\/certification support from cross river business development services institutions\/networks to promote their exports, resulting in at least 20 partnerships or contracts signed\n-\tAt least 40 companies improved their competitiveness due to the assured infrastructure through 4 clusters created.\n-\tMore than 200 jobs created on both banks as a result of the support provided \n-\t40 start-ups initiated\/new companies accelerated, with at least 60% led by women.",https://open.undp.org/projects/00139199,River,"Moldova, Republic of",14300,12529,12529
Evidence for transmission aid,"The current project is aimed to provide evidence for planning for STH transmission break in India starting with Telangana and Himachal Pradesh states. CIFF, along with Oriole Global Health, RTI International India and UNDP India, is conducting a baseline survey in 7 districts of Himachal Pradesh (HP) and Telangana to generate granular data on STH prevalence and WASH practices along with detailed epidemiological models of the transmission dynamics.\n\nAs part of the above project, UNDP is aimed to explore the expansion of the CoWIN platform for tracking of beneficiaries of Multi-Drug Administration (MDA) for real time coverage monitoring for programme managers at various levels.",https://open.undp.org/projects/00143067,WASH,India,128993,14138,14138
Support to Water Initiatives of Tajikistan,The overall Objective of the project is two-fold: a) to provide support in organization of the International Water Conference 2020; and b) to develop a project proposal in support of the implementation of IWRM-based water sector policy reforms.,https://open.undp.org/projects/00126008,IWRM,Tajikistan,20000,15681,15681
"Technical Support to Tajikistan Water Sector Reform, TS-","The Government of Tajikistan is implementing a Water Sector Reform Program to achieve a significant change in water access and use across multiple stakeholders. The process is led by the Ministry of Energy and Water Resources (MEWR). Through this project, UNDP will support MEWR to achieve an efficiently planned, developed and managed water sector with the specific objectives of (1) Improving water sector coordination, (2) Strengthening the enabling environment for water sector reform and (3) accelerating Water Sector Reform.",https://open.undp.org/projects/00138713,Water,Tajikistan,68580,26316,26316
Innovative Financing basic sanitation & waste Management,"UNICEF, UNDP and UNCDF are seeking funding from the Joint SDG Fund (Component 2) to implement a Joint Programme (JP) that aims to catalyze investments in sustainable basic sanitation and waste management in Ghana, especially by unblocking private finance flows. This will contribute to accelerate the achievement of SDG6 and SDG11. The focus will be to strengthen and scale up the Basic Sanitation Fund (BSF) - a revolving fund that provides access to affordable finance to increase access to basic sanitation - while reinforcing an ecosystem of incentives to reduce barriers to public and private investments. The SDG Fund approved the concept note and has provided some funding to support the development of a full project proposal.",https://open.undp.org/projects/00131159,Sanitation,Ghana,26958,26958,26958
Accelerating Green and Climate Finance,"The Project aims to increase private sector investments into gender responsive nature-based solutions for climate resilient technologies, innovations, practices and approaches. This, in support of a just transition to resilient and low emission development that sustains nature and ecosystems and protects the rights of all who are affected and at risk. This Project will contribute to the realization of the economic prize offered by investments in nature-based solutions in the Philippines. This Project will demonstrate how these additional investments can generate solid financial returns and contribute to the achievement of other SDG goals such as gender equality, expanding access to clean water, job creation, increase in incomes of local communities, increased food production, increased sustainable consumption and production, enhanced natural resilience, and many more.",https://open.undp.org/projects/00130666,Water,Philippines,60500,34767,34767
Somalia Humanitarian Flood Response Fund,"Juba and Shabelle Basins Flood Control, Catchment Management and Improved Livelihood Opportunities. The project will complete ongoing water management infrastructure activities.",https://open.undp.org/projects/00045672,"Basin, Flood, Water",Somalia,41086,40783,40783
Conservation of Land Resources FSP,"The objective of the project is to promote land degradation neutrality, restore and improve the use of land and water resources in Turkmenistan’s Amudarya watershed to enhance the sustainability and resilience of livelihoods and globally significant ecosystems. This will be achieved through a multifocal strategy, that includes three interrelated outcomes that will support the government’s efforts to prioritize policies and technical capacities to address desertification and biodiversity loss and  deliver multiple Global Environmental Benefits (GEBs). The GEF investment will promote non-depleting farming and at the same time effective conservation of critical ecosystem services, through a no-net-loss approach to the land-based natural capital, within the context of supporting sustainable livelihoods for local resource users.",https://open.undp.org/projects/00128715,Water,Turkmenistan,128744,41376,41376
"Conservation and sustainable management of lakes, wetlan","The objective of the project is to enhance the resilience of the ecosystems and livelihoods in Lower Amudarya and Aral Sea Basin (LADAB) through land degradation neutrality (LDN) compatible integrated land-water management in the productive landscapes around PAs and KBAs\/IBAs. The four components proposed by this project have been designed within available GEF and co-financing framework to address the corresponding drivers of land, water degradation and biodiversity decline, which are directly linked to the diminishment and loss of lake, wetland and riparian biodiversity in this arid landscape. The project will deliver Global Environmental Benefits using a participatory approach that ensures promotion of women, youth and vulnerable groups and equitable participation opportunities. This will result in the establishment of an integrated water management framework linking “water saving agriculture” on 1,050,910 ha of irrigated land in LADAB landscape with the sustainable management of the minimum and the maximum  ecological flows, required to sustain 957,260 hectares of lakes, wetlands and riparian zones; participatory Sustainable Land Management (SLM) measures applied to 100,000 ha of pastureland,  tugai and tauranga forest ecosystem and halting habitat degradation; extension of the PAs national system’s coverage, to include 9 additional KBAs\/IBAs, through the legal designation of 3,094,600 ha new PAs which, coupled with an expected 20% increase in the  management effectiveness  of the exiting PAs and a guaranteed minimum ecological flow to sustain the deltaic water bodies, will cumulatively result into  stabilized  population of the key indicator species and the ecological integrity of a  chain of watered lands along the Aral coastline, crucial for preventing desertification and loss of biodiversity",https://open.undp.org/projects/00120486,"Wetland, River, Lake",Uzbekistan,44889,42603,42603
PAL/ 95R52 Upgarding of Hebron Sewage System,,https://open.undp.org/projects/00044853,SDG6,Prog for Palestinian People,46691.00,46690.00,46690
IPC139880- FAO SP programmes,"To generate knowledge for policy support about the adequacy and impact of social protection programmes in the fisheries and aquaculture sector, particularly those that combine fisheries management and livelihood protection objectives. In Paraguay, the objective is to assess the social assistance benefit for fishers, Programa de Asistencia a Pescadores del Ministerio de Desarrollo Social, including its registry. In Brazil, the objective is to conduct an international benchmarking of the financial compensation and characteristics of similar interventions during closed seasons to inform policymakers with a focus on the use of the registries. In Tunisia, the objective is to support policy reforms, based on an assessment of the coherence between fisheries and social protection and a feasibility study to provide solutions for extending social security coverage and improving the adequacy of benefits to artisanal fishers and workers in the sector.",https://open.undp.org/projects/00139880,Aqua,Brazil,66268,47344,47344
Fiji LMMA Project (PPG),"The project comes at a time when the Government of Fiji has made a voluntary commitment to the UN Oceans Conference in 2017 to expand its large-scale marine managed areas through the development of a legally-recognized multiple-use marine spatial plan for Fijian waters by 2018, and a network of integrated terrestrial and marine managed areas across the globally significant Lau seascape operating under a co-management framework by 2025. This is further bolstered by the Fiji locally managed marine areas (FLMMA) Network voluntary commitment to have established an effectively managed and governed network of LMMAs in Fijian communities covering 100% of Fiji traditional fishing grounds (or iQoliqoli) by 2025. Together these voluntary commitments provide an excellent foundation for the proposed project.\n\nTo help move towards these voluntary commitments, the project aims to address the negative impacts of unsustainable sector-led development practices on biodiversity-rich coastal and marine ecosystems of Fiji, while taking into account inclusive and equitable social and economic development for dependent communities and local economies, as well as safeguarding against threats to marine biodiversity from unplanned and haphazard developments. The objective of the project is to strengthen and integrated locally managed marine areas into Fiji’s Marine Protected Area (MPA) system through improved institutional and local capacity, management planning and monitoring. \n\nThe project recognizes the fact that the seascapes underpin the lives and livelihoods of a large number of local communities and that implementation of a coherent strategy to promote sustainable, biodiversity-friendly livelihood and economic options is an integral part of the solution. The project objective is to be achieved through the implementation of three inter-related and mutually complementary Project Outcomes that are focussed on addressing existing barriers.",https://open.undp.org/projects/00109881,Water,Fiji,95304,48704,48704
Rehabilitation infrastrustures agricoles,"The floods of April 2021 had damaged the wells in Assamo. Based on the post disaster needs assessment conducted after the floods, 50 wells were identified which need rehabilitation. These wells are mostly in the riverbed providing water for irrigation and some are in the community.",https://open.undp.org/projects/00106811,"Dam, River, Irrigation, Flood",Djibouti,400000,49174,49174
Emergency assistance to mudflow affected population of K,"The objective of this Initiation Plan is to enhance immediate response capacities in follow up to the Government appeal to support mudflow affected community of Khuroson district.\n\nHeavy rains on 14-16 May, 2020 caused a mudflow in Khuroson, Asadullo and Pakhtaoobod villages of\nAyni Jamoat, Khuroson district, Khatlon Region. The preliminary assessment conducted by district level\nemergency commission highlights that the mudflow damaged 338 houses, 14 houses have been fully and 1\npartially damaged. The mudflow damaged also the critical infrastructure, including roads, bridges,\nelectricity lines, and caused flooding the kitchen gardens and household yards. Damages to livelihoods is\nnot assessed yet.",https://open.undp.org/projects/00128831,"Dam, Flood",Tajikistan,77519,50700,50700
Data for Food Security Preparedness,"Djibouti is currently affected by a combination of factors that are leading to a sharp price increase of essential commodities and reduction of the purchasing power of Djiboutians, which may annihilate years of development progress and send back to poverty the most vulnerable population: \n1.\t90% of the food consumed by Djiboutians is imported, which makes Djibouti specially affected by the global increase on energy and food prices in the past few months.\n2.\t85% of the GDP of Djibouti comes from the seaport activity, and 90% of that activity is imports and exports from Ethiopia. The COVID-19 crisis exacerbated the fragility of this mono-specialized business model, which leaves 80% of youth out of job.\n3.\tConflict in Ethiopia has aggravated the isolation of Djibouti, surrounded by Somalia, Yemen and Eritrea, and reduced State income by at least 20%.\n4.\tThe country is facing the third consecutive below average rainy season, as the rest of the Horn of Africa. The ongoing drought has exacerbated existing vulnerabilities of the population, that is already affected by multiple shocks, affecting the purchasing power of the population and especially food security.\nCERF allocated USD 2 Million on 13 May 2022 to alleviate the impact of those compounding shocks on 56,340 acutely vulnerable women, men, girls and boys as well as people living with a handicap in the rural localities of Ali Sabieh, Arta, Obock, Tadjourah and Dikhil regions. This humanitarian funding will allow UNICEF, WFP, FAO and UNHCR to implement key life-saving activities through direct food inputs, WASH, animal feeding and protection (See Annex I). \nHowever, the national social protection registry includes 400,000 Djiboutians below the poverty threshold. In addition, another 200,000 Djiboutians are directly facing falling back to the poverty trap. This situation affecting 60% of the whole population calls for a swift and integrated response by the Government of Djibouti to respond to the socio-economic impact",https://open.undp.org/projects/00144414,"WASH, Drought",Djibouti,125000,51831,51831
Strengthened Community Resilience,"The full-size project will provide foundations for sustainability and replication for a “green recovery”, that in turn will boost the security, reliability and affordability of energy in Armenia.  Green investments have the potential to accrue social and environmental dividends while helping to generate financial benefits and contributing to economic recovery. Energy efficient (EE) and renewable energy (RE) investments in buildings and infrastructure in communities can help reduce energy bills and thus free up financial resources for alternative and immediate needs – not least in relation to vulnerable populations. This can be done while creating “green” jobs, preventing deforestation and reducing the dependence on imported fossil fuels.",https://open.undp.org/projects/00140158,Deforestation,Armenia,153631,52235,52235
Seventh OP GEF-SGP in Indonesia,"To build social, economic, and socio-ecological resilience through community-\nbased activities for global environmental benefits and sustainable development in the following landscapes within the Wallacea biogeographical region in Indonesia: 1) Sabu Raijua District, East Nusa Tenggara Province; 2) Nantu-Boliyohuto Wildlife Reserve buffer zone; Gorontalo Province; 3) Balantieng Watershed, South Sulawesi Province; and (4) Bodri Watershed, Central Java Province.",https://open.undp.org/projects/00141259,Water,Indonesia,227304,58491,58491
Support to post disaster needs assessment in Nabeul,"The torrential rains that fell on Saturday 22 September in Nabeul (Cap Bon peninsula in the North east of Tunisia), and the ensuing floods, caused a heavy human and material damage in at least thirteen cities in the governorate of Nabeul, repsenting more than 50% of the population.",https://open.undp.org/projects/00114489,Flood,Tunisia,60182,59763,59763
"GCF -water efficiency in Agr, sector",To enhance water security at the household level in the Dead Sea Basin through the installation of rooftop rainwater harvesting structures and water saving devices for households and preparation of landscape resilience investment plans.,https://open.undp.org/projects/00099691,Water,Jordan,60000,60730,60730
Protection of the Litani river,"The Litani is the longest river in Lebanon of 170 km long with a watershed of about 2,181 Km2 (21% of the Lebanese territories including territorial waters). The pollution of the Litani Basin has been on the Government of Lebanon radar screen especially since 2011 where pressures emanating from municipal, industrial and agricultural sources were exacerbated by the Syrian displaced settling in various parts of the basin. Hence, the Litani Basin is a growing source of concern as the Upper Litani Basin (ULB) cost of environmental degradation (COED) stands at US$ 227 million in 2012 equivalent on average to 2.2% of ULB GDP and 0.5% of Lebanon GDP and must have increased since.\n\nThe objective is to put the Litani River on a sustainable path through the improved environmental governance in the sectors of solid waste, industrial waste and agriculture. \n\nThe current Qaraoun Depollution Programme (QaDePro) corresponds to the LB 25 billion (equivalent to US$ 16.58 million) MOE component of the overall Litani Pollution Prevention Framework Law 63\/2016 (US$ 730 million) falling under the responsibility or coordination of the MOE over 2018-2023 periods and includes: waste management responsibility as well as overall governance and stewardship; industrial depollution responsibility; and agricultural depollution coordination. When possible, synergistic interventions and financial leveraging from ongoing national and donor-funded programmes and projects will be sought to increase efficiency and co-benefits (local and global pollution abatement).",https://open.undp.org/projects/00111422,River,Lebanon,72516,60764,60764
IPC106275 PNUD Studies and proposal for Measures SDG 6,"The objective of this Agreement is to study and to propose a strategy for monitoring and management mechanisms throughout the national territory for programs and public policies that contribute to the achievement of the Sustainable Development Goal 6 on water and sanitation (water supply, depletion and final disposal components), and its developments, in order to subsidize the National Water Agency and contribute to make it a protagonist in the implementation and monitoring of the SDG in the country, through three pillars:\n1.\tMapping of the essential elements that are factors of success and impediment to the implementation and monitoring of the SDG 6, with study of experiences;\n2.\tGuiding proposal for the implementation of the SDG 6;\n3.\tGuiding proposal for the monitoring of the SDG 6.",https://open.undp.org/projects/00106275,"Sanitation, Water",Brazil,142920,61023,61023
Lebanon Financing Facility,"The project aims at responding to urgent and critical environmental issues arising out of the PoB explosion on August 4, 2020 and minimizing\/ mitigating public health and environmental risks. The interventions, more specifically designed towards the management and disposal of demolition waste generated from the damaged buildings and asbestos contaminated waste, rehabilitation of damaged solid waste infrastructure and technical assistance measures for their sustainable operation.",https://open.undp.org/projects/00136487,Dam,Lebanon,178864,61196,61196
