Project Title,Output Description,Transparency Portal,Keyword,Country TRANSPARENCY,Budget,Expences from BPI,EXPENCES without minos
Programme Environnement et Gest. Durable du Capital Nat,"le Programme vise à accompagner les efforts du Ministère de l’Environnement, des Eaux et Forêts (MEEF), dans les aspects : 1) stratégiques de mise à jour et d’harmonisation des cadres stratégiques, politiques et légaux sur l’environnement intégrant l’équité de genre et de pilotage décentralisé de la gouvernance environnementale pour un développement inclusif, durable, 2) programmatiques et opérationnels d’amélioration des performances de delivery des projets et programmes du portefeuille intégrant un alignement effectif au sous axe 2 du CPD ; et 3) méthodologiques de mobilisation des ressources nécessaires au développement du secteur. Globalement, le Programme répond à un impératif d’efficacité et d’efficience des ressources allouées aux projets et programmes pour une meilleure performance et diligence dans la contribution à la prise en charge des plus grandes priorités nationales par les projets et programmes du MEEF sous la modalité d’exécution nationale (NIM).",https://open.undp.org/projects/00107168,Eau,Guinea,5628899,4347492,4347492
SystÃ¨me Alertes PrÃ©cauces,Résultat 2.1: Amélioration des connaissances et de la compréhension de la variabilité du climat et des risques induits par les changements au niveau des pays et dans les zones vulnérables ciblées\r\nRésultat 2.2: Renforcement de la capacité d'adaptation pour réduire les risques de pertes économiques induites par le climat,https://open.undp.org/projects/00074268,Eau,Benin,4543338,4379050,4379050
DECENTRALISATION ET DEVELOPPEMENT LOCAL,"Le projet prévoit donc des interventions aux niveaux central et local, incluant l’analyse et la formulation des politiques, le renforcement institutionnel des acteurs centraux et le renforcement des capacités locales, particulièrement en lien avec les nouvelles exigences de la gestion municipale. Le projet vise à tracer les bases d’un programme cadre permettant de mobiliser d’autres financements de bilatéraux et\/ou de la coopération décentralisée en appui aux municipalités.",https://open.undp.org/projects/00065430,Eau,Cape Verde,4618010,4385656,4385656
Appui au Parlement tunisien 2015-2021,"Assurer la continuité des activités de l’Assemblée pendant la crise de la Covid-19 = Le « Business Continuity Plan » comporte six points destinés à permettre à l’Assemblée de s’acquitter des obligations qui lui sont dévolues par la constitution, et continuer ainsi à légiférer et à exercer un suivi et un contrôle de l’action gouvernementale même pendant le confinement général et au-delà de celui-ci, en respectant les impératifs de distanciation sociale. Ces mesures portent essentiellement sur les modalités de travail à distance, notamment les séances plénières, les réunions de commissions et de Présidents de groupes parlementaires, ainsi que celles du Bureau.",https://open.undp.org/projects/00087365,Eau,Tunisia,4732760,4459316,4459316
MICROENTERPRISE CREATION IN POOR AREAS OF PORT-AU-PRINCE,"L'objectif global du projet PNUD-Corée 2 sera d'améliorer les moyens de subsistance et les opportunités d'emploi pour les femmes vivant dans les zones les plus vulnérables de Port-au-Prince et de ses environs en leur permettant d’accéder aux ressources et aux bénéfices de développement nécessaires à leur autonomisation sociale et économique. \nCe projet aborde la deuxième phase d’un projet pilote PNUD-Corée débuté en 2011, suite au tremblement de terre, et dont l’objectif visait à renforcer les moyens de subsistance de femmes issues des quartiers les plus affectés par la catastrophe. Cette seconde phase a été conçue sur la base des leçons apprises du projet pilote et vise à compléter l’accompagnement initialement pourvu aux bénéficiaires de la première phase et à étendre la portée des interventions à plus large échelle, en ciblant un plus grand nombre de nouveaux bénéficiaires. \nCe projet s’articule autour de trois produits qui consistent à i) améliorer la disponibilité des données sur les opportunités économiques pour les femmes ; ii) renforcer les capacités, les réseaux et l'assistance technique et financière disponible pour les femmes entrepreneures et les travailleuses informelles et à iii) contribuer à la création d’un environnement propice à l'égalité des sexes et à l'autonomisation économique des femmes.\nLe premier produit sera une phase analytique et préparatoire ; le second sera une étape de renforcement et de développement des capacités d'entreprenariat des femmes, et la dernière étape inclura des activités de sensibilisation, de plaidoyer politique et d'évaluation du projet.",https://open.undp.org/projects/00099803,Eau,Haiti,5343918,4515938,4515938
Business Promotion Center,"Le présent projet contribuera à la promotion et au développement de l’entreprenariat au niveau local à travers la mise en service de centres régionaux de ressources pour l’entrepreneuriat, les toutes petites entreprises et le développement local au Bénin. Ces centres appelés « Business Promotion Center » seront de véritables centres d’assistance et de services au profit des entreprises locales, des futurs entrepreneurs, de la promotion de l’économie locale et du développement des affaires.  Pour assurer leur rayonnement, les Business Promotion Center seront installés progressivement  dans les principales villes du Bénin à savoir : Cotonou, Porto-Novo, Parakou, Bohicon, Lokossa, Natitingou.",https://open.undp.org/projects/00066629,Eau,Benin,4734667,4583333,4583333
Programme dâ€™Appui aux Parcs de lâ€™Entente: Interventions dans les aires protÃ©gÃ©es-Phase II,"Le Programme d'Appui aux Parcs de l'Entente (PAPE) vise à renforcer durablement la conservation des écosystèmes du complexe WAP (W, Arly, Pendjari) avec une perspective régionale, et avec optimisation des bénéfices pour la population riveraine",https://open.undp.org/projects/00085938,River,Burkina Faso,5197708,4625253,4625253
Appui Ã  l'organisation de la COP22,"Le Maroc accueille la 22ème session de la Conférence des Parties à la Convention Cadre des Nations Unies sur les Changements Climatiques (COP22) du 7 au 18 novembre 2016 à Marrakech.\nAprès Paris « COP des décisions », Marrakech est la « COP de l’Action et de l’Innovation » en matière d’atténuation et d’adaptation au changement climatique.\nCette conférence constitue une réelle opportunité qui s’offre au Maroc pour exposer son modèle de développement durable et de lutte contre les Changements Climatiques et pour démonter son rôle de Leadership au niveau africain sur les questions climatiques.\nAinsi, le PNUD à travers ce projet compte apporter tout l’appui nécessaire, notamment via la mobilisation des ressources financières, pour soutenir le gouvernement Marocain et toutes les parties prenantes concernées dans la mise en œuvre des activités de la COP22, notamment :\nActivité 1 : Appui à l’organisation logistique de la COP22 ;\nActivité 2 : Appui à la mobilisation de la société civile pour la COP22 ;\nActivité 3 : Appui aux activités de communication liées à la COP22 ;\nActivité 4 : Appui à la préparation et l’organisation des évènements connexes et des sides-events de la COP 22 ;\nL’expérience et l’expertise du PNUD à l’échelle nationale et internationale seront mises à la disposition du gouvernement du Maroc pour contribuer à la réussite de cet important événement d’envergure internationale.",https://open.undp.org/projects/00096480,Eau,Morocco,5352034,4629644,4629644
Strengthening the resilience of rural livelihoods and sub-national government system to climate risks and variability,Renforcement de la résilience des moyens d’existence ruraux et du système de gouvernance nationale et infranationale face aux risques climatiques et à la variabilité du climat au Bénin. Le changement climatique et l’égalité des sexes sont inclus dans les plans de développement aux niveaux national et infranational,https://open.undp.org/projects/00107827,Eau,Benin,5305603,4917948,4917948
Appui au Programme,Le bureau de pays est doté de capacités de suivi\/évaluation et de gestion des connaissances et ces fonctions sont intégrées dans le travail quotidien.  Les capacités de mobilisation des ressources sont aussi mises en place.  Le travail du bureau est communiqué de manière systématique.  La qualité du programme est améliorée avec le développement des capacités techniques et de gestion des programmes et projets.  Le bureau a également pu répondre à des requêtes du Gouvernement et explorer différentes initiatives pour améliorer le programme.,https://open.undp.org/projects/00057026,Eau,Haiti,5928028,4963668,4963668
RESILIENCE DES FEMMES ET ENFANTS AU CC,"C'est un projet d'adaptation à base communautaire , centré sur les besoins  des femmes et des enfants au niveau des quatre provinces de la RDC. Son objectif est d’améliorer  les capacités adaptation des producteurs et ménages ruraux afin de réduire la vulnérabilité des moyens de subsistance des communautés touchées par les changements climatiques. Il compte 5 extrants: \r\n\r\nExtrant 1 : Des moyens de subsistance alternatifs, résilients au changement climatique  tout en étant efficients sont développés par les groupements de femmes pour augmenter leurs revenus et améliorer l’état nutritionnel de la famille. \r\n\r\nExtrant 2:  Restauration de 15 ha de bas-fonds fertiles dans les zones exposées aux risques climatiques élevés afin de soutenir les activités résilientes de subsistance\r\nExtrant 3: Au moins 100 producteurs de semences et 50 groupes de femmes sont appuyés pour la production et la distribution de semences certifiées des variétés résilientes dans les zones d'intervention et dans les environs des stations de l'INERA\r\n\r\nExtrant 4 : Au moins 4 stations automatiques agro-météorologiques et 400 pluviomètres fournis, en vue de la production d’informations agro-météorologiques et de la sécurisation des productions contre les risques climatiques\r\n\r\nExtrant 5: Des mécanismes d’apprentissage communautaires sont établis, ainsi que des expériences partagées, à travers des sites internet, des publications techniques, des vidéos, des fora et autre média pertinents (réseaux sociaux)",https://open.undp.org/projects/00082660,Eau,Democratic Republic of Congo,6083447,5246503,5246503
PrÃ©vention des conflits et cohÃ©sion sociale,"Le projet proposé vise les objectifs suivants : (i) contribuer à la réduction des conflits et des violences récurrents liés aux questions politiques et constitutionnelles par le renforcement des capacités au niveau national et communautaire de prévention et de gestion des conflits dans les régions les plus affectées par les violences ; (ii) favoriser la résolution de la crise politico-institutionnelle par l’appui aux efforts de la médiation de la CEDEAO soutenue par les Nations Unies. Le projet entend y contribuer notamment en œuvrant à l’émergence d’un leadership transformationnel au niveau des agents de changement que sont les jeunes, les femmes, les responsables de la société civile, les media, les communautés locales y compris des chefferies traditionnelles et congrégations religieuses, tous engagés pour l’appropriation des réformes constitutionnelles et institutionnelles par les communautés, l’éradication de la violence notamment liée aux crises politiques. Il s’agira aussi de doter les institutions nationales concernées de capacités en prévention et de gestion des conflits par des mécanismes alternatifs locaux d’éradication des violences. (iii) Favoriser la protection des droits de l’homme et des enfants dans un contexte de tensions politiques à travers le renforcement des capacités nationales en matière d’éducation à la paix, de protection des droits de l'homme et de l’enfant et de promotion de l’éducation à la citoyenneté.",https://open.undp.org/projects/00115494,Eau,Togo,5829612,5275334,5275334
appui a la prevention et la gestion pacifique des conlits en cote dâ€™ivoire,"Malgré ces avancées de la Réforme du Secteur de Sécurité (RSS), certaines réponses apparaissent marginales au vu des enjeux dans ce domaine. La portée de la RSS étant nationale et visant tous les ivoiriens sans aucune distinction, son document de stratégie multisectoriel et la mise en œuvre de la politique de  déconcentration restent à être compris et soutenus par tous les bénéficiaires avec une intégration effective   à tous les niveaux du processus. Ceci permettra d’en assurer une pleine appropriation nationale et locale des populations par leur participation active dans les cadres de concertation et de collaboration entre les forces de sécurité et  la population. D’où la forte recommandation faite dans le cadre du Plan Prioritaire 2 d’adresser plus efficacement cette problématique qui constitue l’un des défis majeurs pour le rétablissement de la sécurité et pour la construction d’une paix durable. C’est dans cette optique que le gouvernement envisage de lancer la mise en place du processus de RSS dans les différentes régions à travers ses entités déconcentrées. \n\nIl est donc apparu opportun et nécessaire de créer ou de renforcer un cadre de dialogue et d’échange permanent entre les populations , et les forces de sécurité et de défense pour assurer la sécurité des populations dans le respect des droits humains, et de renforcer les capacités des forces de sécurité en matière de protection spécialisée de groupes cibles spécifiques comme les femmes et les mineurs, ce qui contribuera à restaurer la confiance entre la populations et forces de sécurité et de défense et élèvera le niveau de protection de certains groupes particulièrement vulnérables.",https://open.undp.org/projects/00089867,Eau,CÃ´te dâ€™Ivoire,5373492,5337545,5337545
AmÃ©lioration de lAccueil Service Public Phase II,"S’inscrivant pleinement dans le contexte normatif issu, notamment, de la Constitution de juillet 2011, à travers la consécration d’un chapitre dédié à la bonne gouvernance ; de la stratégie gouvernementale de modernisation de l’administration ; de l’entrée en vigueur de la stratégie nationale de lutte contre la corruption dont l’amélioration de l’accueil constitue une des priorités ; de l’adoption en cours de la charte des services publics constituant une base d’amélioration des relations administration – usagers ; le cadre d’aide au développement des Nations Unies 2017-2021 (UNDAF), le projet d’appui à l’amélioration de l’accueil des usagers des services publics, dans sa deuxième phase, est le fruit d’un partenariat entre le MRAFP et le PNUD. Ce projet bénéficiera des synergies offertes par l’action concertée du PNUD et du gouvernement marocain afin de mettre en œuvre le dispositif IDARATI en élargissant l’expérimentation à 29 sites pilotes supplémentaires sur des services représentatifs et d’améliorer ainsi les conditions d’accueil des usagers des services publics en valorisant un modèle d’administration répondant aux meilleurs standards en la matière. \n\nIl consiste à élargir l’expérimentation de la méthodologie d’amélioration de l’accueil dans certains services publics dans des territoires ruraux et urbains à partir d’un audit de ces services et d’une enquête de perception des usagers afin de mettre à niveau les sites en question en réponse aux normes établies en la matière. L’objectif étant de mettre en place un modèle d’administration type par type de service, tenant compte du parcours de l’usager et de ses composantes physique et numérique, par administration cible, prêt à être dupliqué, dans le cadre de la généralisation par le Département partenaire du programme. \n\nCette connaissance fine du fonctionnement des services publics et de l’interaction entre usagers et administrations publiques permettra d’élaborer et de mettre en œuvre des plans d’amélioration d",https://open.undp.org/projects/00113770,Eau,Morocco,7469873,5346805,5346805
Adaptation Climate Change regions montagneuses,"Il s'agit d'un projet qui vise deux objectifs complémentaires mais qui se situent à deux niveaux d'intervention différents. Il y'a d'abord un niveau communautaire pour lequel il s'agit de renforcer la résilience des communautés rurales vivant dans les zones montagneuses de Weima et Assamo. \nLe deuxième niveau concerne les structures institutionnelles qui sont ciblées pour les activités de renforcement des capacités de coordination, de planification, d'exécution et de rapportage dans les questions concernant le changement climatique. \n\nCela devrait aboutir à la réduction des vulnérabilités des ces communautés en face du changement climatique.",https://open.undp.org/projects/00079962,Eau,Djibouti,7727049,5365268,5365268
PROJET PROMOTION FINANCE NOVATRICE COMMUNAUTAIRE,"le projet est conçu pour promotion d’une finance novatrice et d’adaptation communautaire dans les communes autour des réserves naturelles communautaires (Ferlo, Niokolo-Koba, bas delta du fleuve Sénégal et delta du Saloum). Il s'agira d'identifier et d'intégrer les mesures d'adaptation au changement climatique dans les plans de développement locaux; d'établir des mécanismes des financements novateurs (fonds climat décentralisés), de renforcer le réseau de mutuel d'épargne et de crédit afin d'octroyer des crédits agricoles aux populations.et d'améliorer les moyens de subsistance d'au moins 5000 ménages dont 50% de femmes.",https://open.undp.org/projects/00103749,"Eau, Delta",Senegal,7672024,5448307,5448307
Electrification Rurale et Autonomisation des Femmes,"Le projet ambitionne de donner accès à l’énergie électrique dans des zones rurales reculées et ciblées où il existe un potentiel énergétique exploitable, par la mise en place de trois (3) micros réseaux électriques fonctionnant à partir de l'Energie solaire. Ce projet permettra de réduire la fracture villes\/campagnes, de renforcer la cohésion sociale et de contribuer à une plus grande égalité des sexes en améliorant le bien-être domestique et le fonctionnement des services énergétiques ainsi que celui de l’économie locale dans les zones rurales ; de promouvoir des options de services énergétiques décentralisés en milieu rural et de contribuer à la génération d’activités productrices de biens et de services qui bénéficient particulièrement aux femmes et aux autres groupes défavorisés. Par ailleurs, la génération d’électricité à partir des énergies renouvelables garantira une baisse significative de l’émission des gaz à effet de serre, notamment le dioxyde de carbone (CO2).",https://open.undp.org/projects/00104020,Eau,Haiti,6930933,5540564,5540564
PROJET DE RENFORCEMENT DES CAPACITES NATIONALES DE RESILIENCE AU BURKINA FASO,"Le projet pluriannuel de renforcement des capacités nationales de résilience aux niveaux national et locale (régions du Nord et du Sahel affectées par la récurrence des catastrophes naturelles et la présence des réfugiés en provenance du Mali) consiste en un apport de ressources additionnelles pour une meilleure intégration et une meilleure offre de service en matière de Réduction des Risques de Catastrophes, de Relèvement poste catastrophes (y compris sur le plan socio-économique) et de Résilience. Le projet concerne, d'une part, les institutions du Ministère de l'Action Sociale et de la Solidarité Nationale (MASSN), en particulier le Conseil National de Secours d'Urgence et de Réhabilitation (CONASUR) au niveau central (Secrétariat Permanent) et décentralisé, c'est à dire les Conseils Régionaux de Secours d'Urgence et de Réhabilitation (CORESUR) du Nord et du Sahel, et d'autre part les communautés des régions du Nord et du Sahel.",https://open.undp.org/projects/00083021,Eau,Burkina Faso,6402732,5582815,5582815
Addressing coastal climate change vulnerabilities,"Actuellement, les projections des futurs scénarios de changement climatique ne sont pas prises en compte dans les politiques et dans les cadres institutionnels régissant la gestion côtière en Tunisie. Les pratiques de protection du littoral sont généralement réactives avec une préférence pour des travaux d’ingénierie lourde parce que la connaissance institutionnelle de la gestion intégrée des risques des changements climatiques globaux est limitée.\nCette situation est exacerbée par le fait que, les coûts et les avantages de l'adaptation côtière soient mal évalués et négligés dans la plupart des décisions politiques et d'investissement au niveau de la côte. Par conséquent, la Tunisie dispose de moyens insuffisants pour identifier les projets d'adaptation côtière bancables qui peuvent avoir des avantages intersectoriels et réduire simultanément les risques liés aux changements climatiques.\nDans l'ensemble, ces problèmes font que le développement durable dans la zone côtière tunisienne soit irréalisable à l'heure actuelle.\nLe présent projet a pour objectif de promouvoir des stratégies, des technologies et des options de financement innovantes pour répondre aux risques des changements climatiques et leurs impacts sur les populations et les principaux secteurs socio-économiques des zones côtières les plus vulnérables de la Tunisie. Il s’agit donc d’adopter une approche de gestion du littoral basée sur des voies d’adaptation flexibles aux changements climatiques.\nUn ensemble d'instruments économiques sera conçu pour orienter les investissements touristiques et sectoriels, loin des zones littorales vulnérables. Cette approche, permettra d’intégrer au niveau des programmes et des stratégies de développement la prise en compte du risque de changement climatique. Les secteurs public et privé seront des catalyseurs importants pour les interventions d'adaptation et pour l’appui à la surveillance côtière.\nPlus précisément, le projet propose :\n•\tLa mise à jour des cadres régleme",https://open.undp.org/projects/00079688,Eau,Tunisia,5724491,5610437,5610437
RÃ©intÃ©gration Personnes DÃ©placÃ©es et CohÃ©sion,"Dans le cadre de la mise en œuvre de la stratégie de solutions durables, plusieurs interventions ont été engagées pour la réintégration durable des personnes déplacées et rapatriés en Côte d’Ivoire. Alors que des efforts sont déployés pour endiguer les conflits qui ont causé le déplacement, il reste encore beaucoup à faire à la fois économiquement et socialement pour combler les gaps des besoins des personnes rapatriées et pour répondre aux défis de la lutte contre la pauvreté et la consolidation de la cohésion sociale dans les zones de retour ou de réinstallation. \nLe projet proposé vise à consolider les acquis de la première phase du projet par le suivi et le renforcement des mécanismes de durabilité. Il contribuera également à la stabilisation post-crise dans les zones de retour à travers des actions de prévention des crises, de consolidation de la cohésion sociale et de la cohabitation pacifique.\nL’initiative s’inscrit dans une dynamique de réintégration socioéconomique durable des personnes rapatriées, de prévention des conflits inter et intra-communautaires, la migration irrégulière, la radicalisation des jeunes et le renforcement de la coexistence pacifique dans les zones de retour. Il contribuera significativement à la restauration de la cohésion sociale et de la coexistence pacifique dans les zones cibles pour contribuer à un climat apaisé Les Interventions porteront sur : \n•\tLe renforcement de la cohésion sociale et la coexistence pacifique grâce au dialogue communautaire et l'accès aux infrastructures sociales de base\n•\tLa réintégration socioéconomique des personnes rapatriées dans les communautés d'accueil \n•\tLa promotion de l’entrepreneuriat jeune à travers la formation professionnelle et la création de micro-entreprises",https://open.undp.org/projects/00098298,Eau,Côte d’Ivoire,6748320,5766034,5766034
Appui aux Institutions DÃ©mocratiques et SociÃ©tÃ© civile,Projet d'appui aux Institutions Démocratiques et aux Organisations de la Société Civile a pour objectif de contribuer à l'amélioration de la gouvernance au  niveau provincial en renforçant les institutions démocratiques et les organisations de le la société civile dans la promotion de la gouvernance des secteurs du PIC.,https://open.undp.org/projects/00072464,Eau,Democratic Republic of Congo,6041447,5767114,5767114
